{
  "schema_version": "comparison_summary.v1",
  "generated_at": "2026-03-14T00:00:00+00:00",
  "date": "2026-03-13",
  "baseline_ref": "canon2",
  "current_ref": "reg2",
  "status": "ok",
  "warnings": [],
  "sources": [
    {
      "source": "elpais",
      "baseline_count": 10,
      "current_count": 11,
      "delta_abs": 1,
      "delta_pct": 10.0,
      "status": "ok",
      "warnings": [],
      "metrics": {
        "discovered": 20,
        "processed": 12,
        "kept": 11,
        "discarded_by_date": 1,
        "errors": 0,
        "stop_reason": "completed",
        "last_url": "https://elpais.com/example"
      }
    }
  ]
}
